### ISSUE TITLE
copy 一份运行，抓包发现没有保活

### ISSUE THREAD

**Issue by wangkaisdu** [openresty/lua-resty-redis#69]
你好，那个例子我复制了一份，然后运行，访问了下那个页面多次，但是每次都关闭socket连接。并没有保活。

**Comment by agentzh** [comment]
@wangkaisdu Please, no Chinese here. This place is considered English only. If you really want to use Chinese. Please join the openresty (Chinese) mailing list instead. Please see https://openresty.org/#Community

Regarding your question, the issue may come from your misuse of the `set_keepalive` method call. If you really believe it's a bug in this library or even the underlying ngx_lua module, please provide a minimal and standalone example that we can run on our side to reproduce the issue. Please see http://openresty.org/faq.html#how-should-i-report-a-problem for more details. Thanks for your cooperation.

**Comment by wangkaisdu** [comment]
Thanks very much,I will retry later.

**Comment by wangkaisdu** [comment]
hi,I try that again. forgive my poor english please.

I copy the example from https://github.com/openresty/lua-resty-redis ,but it don't keep-alive, and I paste the network Package in the end.

##This is the example: 
```lua
location /test {
            content_by_lua '
                local redis = require "resty.redis"
                local red = redis:new()

                red:set_timeout(1000) -- 1 sec

                -- or connect to a unix domain socket file listened
                -- by a redis server:
                --     local ok, err = red:connect("unix:/path/to/redis.sock")

                local ok, err = red:connect("127.0.0.1", 6379)
                if not ok then
                    ngx.say("failed to connect: ", err)
                    return
                end

                ok, err = red:set("dog", "an animal")
                if not ok then
                    ngx.say("failed to set dog: ", err)
                    return
                end

                ngx.say("set result: ", ok)

                local res, err = red:get("dog")
                if not res then
                    ngx.say("failed to get dog: ", err)
                    return
                end

                if res == ngx.null then
                    ngx.say("dog not found.")
                    return
                end

                ngx.say("dog: ", res)

                red:init_pipeline()
                red:set("cat", "Marry")
                red:set("horse", "Bob")
                red:get("cat")
                red:get("horse")
                local results, err = red:commit_pipeline()
                if not results then
                    ngx.say("failed to commit the pipelined requests: ", err)
                    return
                end

                for i, res in ipairs(results) do
                    if type(res) == "table" then
                        if res[1] == false then
                            ngx.say("failed to run command ", i, ": ", res[2])
                        else
                            -- process the table value
                        end
                    else
                        -- process the scalar value
                    end
                end

                -- put it into the connection pool of size 100,
                -- with 10 seconds max idle time
                local ok, err = red:set_keepalive(10000, 100)
                if not ok then
                    ngx.say("failed to set keepalive: ", err)
                    return
                end

                -- or just close the connection right away:
                -- local ok, err = red:close()
                -- if not ok then
                --     ngx.say("failed to close: ", err)
                --     return
                -- end
            ';
        }
```


##This is the result:  

the client send fin package immediate after receive the data.

```
11:04:29.128486 IP localhost.59740 > localhost.6379: Flags [S], seq 3274653696, win 65535, options [mss 16344,nop,wscale 5,nop,nop,TS val 595791539 ecr 0,sackOK,eol], length 0
11:04:29.128529 IP localhost.6379 > localhost.59740: Flags [S.], seq 1325370336, ack 3274653697, win 65535, options [mss 16344,nop,wscale 5,nop,nop,TS val 595791539 ecr 595791539,sackOK,eol], length 0
11:04:29.128538 IP localhost.59740 > localhost.6379: Flags [.], ack 1, win 12759, options [nop,nop,TS val 595791539 ecr 595791539], length 0
11:04:29.128545 IP localhost.6379 > localhost.59740: Flags [.], ack 1, win 12759, options [nop,nop,TS val 595791539 ecr 595791539], length 0
11:04:29.128592 IP localhost.59740 > localhost.6379: Flags [P.], seq 1:38, ack 1, win 12759, options [nop,nop,TS val 595791539 ecr 595791539], length 37
11:04:29.128613 IP localhost.6379 > localhost.59740: Flags [.], ack 38, win 12758, options [nop,nop,TS val 595791539 ecr 595791539], length 0
11:04:29.128645 IP localhost.6379 > localhost.59740: Flags [P.], seq 1:6, ack 38, win 12758, options [nop,nop,TS val 595791539 ecr 595791539], length 5
11:04:29.128661 IP localhost.59740 > localhost.6379: Flags [.], ack 6, win 12759, options [nop,nop,TS val 595791539 ecr 595791539], length 0
11:04:29.128710 IP localhost.59740 > localhost.6379: Flags [P.], seq 38:60, ack 6, win 12759, options [nop,nop,TS val 595791539 ecr 595791539], length 22
11:04:29.128728 IP localhost.6379 > localhost.59740: Flags [.], ack 60, win 12757, options [nop,nop,TS val 595791539 ecr 595791539], length 0
11:04:29.128758 IP localhost.6379 > localhost.59740: Flags [P.], seq 6:21, ack 60, win 12757, options [nop,nop,TS val 595791539 ecr 595791539], length 15
11:04:29.128775 IP localhost.59740 > localhost.6379: Flags [.], ack 21, win 12758, options [nop,nop,TS val 595791539 ecr 595791539], length 0
11:04:29.128828 IP localhost.59740 > localhost.6379: Flags [P.], seq 60:172, ack 21, win 12758, options [nop,nop,TS val 595791539 ecr 595791539], length 112
11:04:29.128848 IP localhost.6379 > localhost.59740: Flags [.], ack 172, win 12754, options [nop,nop,TS val 595791539 ecr 595791539], length 0
11:04:29.128899 IP localhost.6379 > localhost.59740: Flags [P.], seq 21:51, ack 172, win 12754, options [nop,nop,TS val 595791539 ecr 595791539], length 30
11:04:29.128911 IP localhost.59740 > localhost.6379: Flags [.], ack 51, win 12757, options [nop,nop,TS val 595791539 ecr 595791539], length 0

11:04:29.128998 IP localhost.59740 > localhost.6379: Flags [F.], seq 172, ack 51, win 12757, options [nop,nop,TS val 595791539 ecr 595791539], length 0
11:04:29.129015 IP localhost.6379 > localhost.59740: Flags [.], ack 173, win 12754, options [nop,nop,TS val 595791539 ecr 595791539], length 0
11:04:29.129020 IP localhost.59740 > localhost.6379: Flags [.], ack 51, win 12757, options [nop,nop,TS val 595791539 ecr 595791539], length 0
11:04:29.129035 IP localhost.6379 > localhost.59740: Flags [F.], seq 51, ack 173, win 12754, options [nop,nop,TS val 595791539 ecr 595791539], length 0
11:04:29.129048 IP localhost.59740 > localhost.6379: Flags [.], ack 52, win 12757, options [nop,nop,TS val 595791539 ecr 595791539], length 0
```
